{
  "$schema": "../../schemas/reconstruction-ledger.schema.json",
  "schema": "hyperflux-reconstruction-ledger-v1",
  "baseline_commit": "c348305bb9c6790141932ddf79f707e5223bb51c",
  "target": {
    "version": "2.0.0",
    "package_release": 1
  },
  "binaries": [
    {"id": "binary-bridge", "path": "crates/hfx-daemon/src/main.rs", "action": "KEEP", "target_owner": "core", "phase": 2, "rationale": "The bridge daemon is the Core runtime."},
    {"id": "binary-cli", "path": "crates/hfx-ops/src/bin/hyperfluxctl.rs", "action": "KEEP", "target_owner": "core", "phase": 2, "rationale": "The installed read-only status, Doctor, and support CLI remains in Core."},
    {"id": "binary-activation", "path": "crates/hfx-ops/src/bin/hyperflux-next-activate.rs", "action": "KEEP", "target_owner": "core", "phase": 2, "rationale": "The advanced disconnected-driver recovery helper remains in Core."},
    {"id": "binary-device-qualification", "path": "crates/hfx-device-qualification/src/bin/hyperflux-next-device-qualification.rs", "action": "MOVE", "target_owner": "source-only", "phase": 3, "rationale": "The browser qualification coordinator is a source-only maintainer entry point and is never installed."},
    {"id": "binary-relay", "path": "crates/hfx-uhid-relay/src/main.rs", "action": "MOVE", "target_owner": "full", "phase": 2, "rationale": "The OpenRazer relay belongs to the optional Full integration component."},
    {"id": "binary-native-qualifier", "path": "crates/hfx-uhid-relay/src/qualifier_main.rs", "action": "KEEP", "target_owner": "source-only", "phase": 3, "rationale": "The transport parity qualifier is a maintainer tool and is never installed."},
    {"id": "binary-shadow", "path": "crates/hfx-sim/src/bin/hfx-shadow.rs", "action": "KEEP", "target_owner": "source-only", "phase": 3, "rationale": "The deterministic migration comparator remains a source-only verifier."}
  ],
  "units": [
    {"id": "unit-bridge", "authority_key": "install-payload:bridge-service", "action": "KEEP", "target_owner": "core", "phase": 2, "rationale": "Core owns the bridge service."},
    {"id": "unit-client-socket", "authority_key": "install-payload:desktop-bridge-socket", "action": "KEEP", "target_owner": "core", "phase": 2, "rationale": "Core owns the per-UID desktop socket."},
    {"id": "unit-client-service", "authority_key": "install-payload:desktop-bridge-proxy-service", "action": "KEEP", "target_owner": "core", "phase": 2, "rationale": "Core owns the per-UID desktop proxy."},
    {"id": "unit-relay", "authority_key": "install-payload:openrazer-native-relay-service", "action": "MOVE", "target_owner": "full", "phase": 2, "rationale": "Full owns the optional OpenRazer relay service."},
    {"id": "unit-preflight", "authority_key": "install-payload:openrazer-native-driver-preflight-service", "action": "MOVE", "target_owner": "full", "phase": 2, "rationale": "Full owns the OpenRazer driver preflight service."}
  ],
  "rules": [
    {"id": "rule-core-sysusers", "authority_key": "install-payload:system-users", "action": "KEEP", "target_owner": "core", "phase": 2, "rationale": "Core owns its service identities."},
    {"id": "rule-openrazer-sysusers", "authority_key": "install-payload:openrazer-system-group", "action": "MOVE", "target_owner": "full", "phase": 2, "rationale": "The OpenRazer compatibility group belongs to Full."},
    {"id": "rule-core-tmpfiles", "authority_key": "install-payload:runtime-directories", "action": "KEEP", "target_owner": "core", "phase": 2, "rationale": "Core owns bridge runtime directories."},
    {"id": "rule-core-udev", "authority_key": "install-payload:device-permissions", "action": "KEEP", "target_owner": "core", "phase": 2, "rationale": "Core owns receiver access rules."},
    {"id": "rule-openrazer-udev", "authority_key": "install-build:openrazer-native-udev-rules", "action": "MOVE", "target_owner": "full", "phase": 2, "rationale": "The transformed OpenRazer device rule belongs to Full."},
    {"id": "rule-openrazer-mount-helper", "authority_key": "install-build:openrazer-native-mount-helper", "action": "MOVE", "target_owner": "full", "phase": 2, "rationale": "The transformed OpenRazer mount helper belongs to Full."}
  ],
  "package_artifacts": [
    {"id": "artifact-bridge", "authority_key": "install-build:bridge-daemon", "action": "KEEP", "target_owner": "core", "phase": 2, "rationale": "Core runtime binary."},
    {"id": "artifact-cli", "authority_key": "install-build:operations-cli", "action": "KEEP", "target_owner": "core", "phase": 2, "rationale": "Core operator CLI."},
    {"id": "artifact-activation", "authority_key": "install-build:activation-utility", "action": "KEEP", "target_owner": "core", "phase": 2, "rationale": "Core recovery utility."},
    {"id": "artifact-relay", "authority_key": "install-build:openrazer-native-relay", "action": "MOVE", "target_owner": "full", "phase": 2, "rationale": "Move the relay from release-8 Core to Full."},
    {"id": "artifact-openrazer-driver", "authority_key": "install-build:openrazer-native-driver", "action": "MOVE", "target_owner": "full", "phase": 2, "rationale": "Move the patched OpenRazer DKMS tree to Full."},
    {"id": "artifact-openrazer-rules", "authority_key": "install-build:openrazer-native-udev-rules", "action": "MOVE", "target_owner": "full", "phase": 2, "rationale": "Move transformed OpenRazer rules to Full."},
    {"id": "artifact-openrazer-helper", "authority_key": "install-build:openrazer-native-mount-helper", "action": "MOVE", "target_owner": "full", "phase": 2, "rationale": "Move transformed OpenRazer helper to Full."},
    {"id": "artifact-openrgb-plugin", "authority_key": "install-build:openrgb-native", "action": "KEEP", "target_owner": "full", "phase": 2, "rationale": "Full remains the plugin owner."},
    {"id": "artifact-kernel-source", "authority_key": "install-payload:kernel-source", "action": "KEEP", "target_owner": "core", "phase": 2, "rationale": "Core owns the HyperFlux receiver DKMS source."},
    {"id": "artifact-dkms-config", "authority_key": "install-payload:dkms-configuration", "action": "KEEP", "target_owner": "core", "phase": 2, "rationale": "Core owns receiver DKMS registration."},
    {"id": "artifact-bridge-unit", "authority_key": "install-payload:bridge-service", "action": "KEEP", "target_owner": "core", "phase": 2, "rationale": "Core service payload."},
    {"id": "artifact-client-socket", "authority_key": "install-payload:desktop-bridge-socket", "action": "KEEP", "target_owner": "core", "phase": 2, "rationale": "Core desktop endpoint payload."},
    {"id": "artifact-client-service", "authority_key": "install-payload:desktop-bridge-proxy-service", "action": "KEEP", "target_owner": "core", "phase": 2, "rationale": "Core desktop proxy payload."},
    {"id": "artifact-relay-unit", "authority_key": "install-payload:openrazer-native-relay-service", "action": "MOVE", "target_owner": "full", "phase": 2, "rationale": "Full service payload."},
    {"id": "artifact-preflight-unit", "authority_key": "install-payload:openrazer-native-driver-preflight-service", "action": "MOVE", "target_owner": "full", "phase": 2, "rationale": "Full preflight payload."},
    {"id": "artifact-core-sysusers", "authority_key": "install-payload:system-users", "action": "KEEP", "target_owner": "core", "phase": 2, "rationale": "Core identity payload."},
    {"id": "artifact-openrazer-sysusers", "authority_key": "install-payload:openrazer-system-group", "action": "MOVE", "target_owner": "full", "phase": 2, "rationale": "Full integration identity payload."},
    {"id": "artifact-full-bridge-drop-in", "authority_key": "install-payload:full-bridge-integration-drop-in", "action": "MOVE", "target_owner": "full", "phase": 2, "rationale": "Full alone adds the optional OpenRazer relay relationship to the Core bridge."},
    {"id": "artifact-full-component-descriptor", "authority_key": "install-payload:full-component-descriptor", "action": "KEEP", "target_owner": "full", "phase": 2, "rationale": "Doctor uses the generated root-owned descriptor to activate Full integration health checks."},
    {"id": "artifact-tmpfiles", "authority_key": "install-payload:runtime-directories", "action": "KEEP", "target_owner": "core", "phase": 2, "rationale": "Core runtime directory payload."},
    {"id": "artifact-core-udev", "authority_key": "install-payload:device-permissions", "action": "KEEP", "target_owner": "core", "phase": 2, "rationale": "Core receiver permission payload."},
    {"id": "artifact-config", "authority_key": "install-payload:default-configuration", "action": "KEEP", "target_owner": "core", "phase": 2, "rationale": "Core preserves the operator configuration across transactions."},
    {"id": "artifact-troubleshooting", "authority_key": "install-payload:operator-troubleshooting", "action": "KEEP", "target_owner": "core", "phase": 2, "rationale": "Minimal operator guidance remains with Core."},
    {"id": "artifact-core-license", "authority_key": "install-payload:core-license", "action": "KEEP", "target_owner": "core", "phase": 2, "rationale": "Core license payload."},
    {"id": "artifact-full-license", "authority_key": "install-payload:openrgb-license", "action": "KEEP", "target_owner": "full", "phase": 2, "rationale": "Full license payload."}
  ],
  "dependencies": [
    {"id": "dep-bitflags", "authority_key": "rust-registry:bitflags@2.13.1", "action": "KEEP", "target_owner": "workspace-shared", "phase": 1, "rationale": "Pinned workspace dependency."},
    {"id": "dep-block-buffer", "authority_key": "rust-registry:block-buffer@0.12.0", "action": "KEEP", "target_owner": "workspace-shared", "phase": 1, "rationale": "Pinned transitive Rust dependency."},
    {"id": "dep-cfg-if", "authority_key": "rust-registry:cfg-if@1.0.4", "action": "KEEP", "target_owner": "workspace-shared", "phase": 1, "rationale": "Pinned transitive Rust dependency."},